[
  {
    "schema_version": "3.0",
    "candidate_id": "model:openai-compatible",
    "provider_id": "openai",
    "model_id": "gpt-compatible-fixture",
    "profile_ref": "openai/gpt-compatible-fixture@fixture-1.0",
    "availability": "AVAILABLE",
    "capabilities": {"coding": true, "planning": true, "debugging": true, "research": true, "review": true, "security": true, "tool_use": true, "structured_output": true, "multimodal": true, "long_context": true},
    "reasoning": {"supported": true, "effort_levels": ["low", "medium", "high"]},
    "limits": {"context_tokens": 128000, "max_output_tokens": 16000, "max_tool_schema_tokens": 12000},
    "tool_support": {"function_calling": true, "structured_output": true},
    "latency": {"class": "interactive", "p50_ms": null, "p95_ms": null},
    "cost": {"class": "balanced", "measured_units": null, "currency": null},
    "evidence_provenance": {"evidence_class": "HOST_MANAGED_FIXTURE", "source": "fixtures/v3/models/openai-compatible.json", "method": "static-contract-fixture"}
  },
  {
    "schema_version": "3.0",
    "candidate_id": "model:anthropic-compatible",
    "provider_id": "anthropic",
    "model_id": "claude-compatible-fixture",
    "profile_ref": "anthropic/claude-compatible-fixture@fixture-1.0",
    "availability": "AVAILABLE",
    "capabilities": {"coding": true, "planning": true, "debugging": true, "research": true, "review": true, "security": true, "tool_use": true, "structured_output": true, "multimodal": true, "long_context": true},
    "reasoning": {"supported": true, "effort_levels": ["low", "medium", "high"]},
    "limits": {"context_tokens": 200000, "max_output_tokens": 16000, "max_tool_schema_tokens": 12000},
    "tool_support": {"function_calling": true, "structured_output": true},
    "latency": {"class": "interactive", "p50_ms": null, "p95_ms": null},
    "cost": {"class": "high", "measured_units": null, "currency": null},
    "evidence_provenance": {"evidence_class": "HOST_MANAGED_FIXTURE", "source": "fixtures/v3/models/anthropic-compatible.json", "method": "static-contract-fixture"}
  },
  {
    "schema_version": "3.0",
    "candidate_id": "model:deepseek",
    "provider_id": "deepseek",
    "model_id": "deepseek-compatible-fixture",
    "profile_ref": "deepseek/deepseek-compatible-fixture@fixture-1.0",
    "availability": "AVAILABLE",
    "capabilities": {"coding": true, "planning": true, "debugging": true, "research": true, "review": true, "security": false, "tool_use": true, "structured_output": true, "multimodal": false, "long_context": true},
    "reasoning": {"supported": true, "effort_levels": ["low", "medium", "high"]},
    "limits": {"context_tokens": 128000, "max_output_tokens": 12000, "max_tool_schema_tokens": 8000},
    "tool_support": {"function_calling": true, "structured_output": true},
    "latency": {"class": "interactive", "p50_ms": null, "p95_ms": null},
    "cost": {"class": "low", "measured_units": null, "currency": null},
    "evidence_provenance": {"evidence_class": "HOST_MANAGED_FIXTURE", "source": "fixtures/v3/models/deepseek.json", "method": "static-contract-fixture"}
  },
  {
    "schema_version": "3.0",
    "candidate_id": "model:glm",
    "provider_id": "glm",
    "model_id": "glm-compatible-fixture",
    "profile_ref": "glm/glm-compatible-fixture@fixture-1.0",
    "availability": "AVAILABLE",
    "capabilities": {"coding": true, "planning": true, "debugging": true, "research": true, "review": true, "security": false, "tool_use": true, "structured_output": true, "multimodal": false, "long_context": true},
    "reasoning": {"supported": true, "effort_levels": ["low", "medium", "high"]},
    "limits": {"context_tokens": 128000, "max_output_tokens": 12000, "max_tool_schema_tokens": 8000},
    "tool_support": {"function_calling": true, "structured_output": true},
    "latency": {"class": "interactive", "p50_ms": null, "p95_ms": null},
    "cost": {"class": "low", "measured_units": null, "currency": null},
    "evidence_provenance": {"evidence_class": "HOST_MANAGED_FIXTURE", "source": "fixtures/v3/models/glm.json", "method": "static-contract-fixture"}
  },
  {
    "schema_version": "3.0",
    "candidate_id": "model:mimo",
    "provider_id": "mimo",
    "model_id": "mimo-compatible-fixture",
    "profile_ref": "mimo/mimo-compatible-fixture@fixture-1.0",
    "availability": "AVAILABLE",
    "capabilities": {"coding": true, "planning": true, "debugging": true, "research": true, "review": true, "security": false, "tool_use": true, "structured_output": true, "multimodal": true, "long_context": true},
    "reasoning": {"supported": true, "effort_levels": ["low", "medium", "high"]},
    "limits": {"context_tokens": 128000, "max_output_tokens": 12000, "max_tool_schema_tokens": 8000},
    "tool_support": {"function_calling": true, "structured_output": true},
    "latency": {"class": "interactive", "p50_ms": null, "p95_ms": null},
    "cost": {"class": "low", "measured_units": null, "currency": null},
    "evidence_provenance": {"evidence_class": "HOST_MANAGED_FIXTURE", "source": "fixtures/v3/models/mimo.json", "method": "static-contract-fixture"}
  }
]
